{
  "contract_version": "source-registration.v1",
  "dataset_kind": "legal_sources",
  "snapshot_date": "2025-01-01",
  "file_id_namespace": "6a36999d-9a98-4a12-aed9-fdbea516e54e",
  "documents": [
    {
      "law_id": "35/2024/TT-BGTVT",
      "source_id": "SRC-007",
      "declared": {
        "law_title": "Quy định về đào tạo, sát hạch, cấp giấy phép lái xe; cấp, sử dụng giấy phép lái xe quốc tế; đào tạo, kiểm tra, cấp chứng chỉ bồi dưỡng kiến thức pháp luật về giao thông đường bộ",
        "document_type": "circular",
        "scope_note": "Đăng ký nguồn bổ sung; chỉ chọn phạm vi/hiệu lực ở cấp đơn vị sau. Chưa nhập corpus.",
        "source_url_candidate": "https://vanban.chinhphu.vn/?pageid=27160&docid=211984",
        "issued_date_candidate": "2024-11-15",
        "inventory_ref": "docs/design/Source Inventory v0.1.docx.md"
      }
    }
  ],
  "files": [
    {
      "law_id": "35/2024/TT-BGTVT",
      "source_set_id": "SRC-007-local-pdf-01",
      "part_order": 1,
      "file_role": "main",
      "raw_file_ref": "data/raw/35-bgtvt.pdf",
      "expected_sha256": "53491f393dd7e5a268451319c6d3a4e89f1f0e59718717918e71833bace18caf"
    },
    {
      "law_id": "35/2024/TT-BGTVT",
      "source_set_id": "SRC-007-local-pdf-01",
      "part_order": 2,
      "file_role": "annex",
      "raw_file_ref": "data/raw/35-bgtvt-kem.pdf",
      "expected_sha256": "a79fd735777e6948bb9cfc8aa4ec556641a616d4bfc2ee0d00e8c26d7e559a94"
    }
  ]
}
